{
  "schema_version": "1.0.0",
  "input_summary": {
    "materials": ["page screenshot"],
    "language": "zh-CN",
    "assumptions": [],
    "limitations": []
  },
  "recognition_summary": {
    "pages_identified": 1,
    "modules_identified": 0,
    "fields_identified": 0,
    "actions_identified": 0,
    "rules_identified": 0,
    "states_identified": 0
  },
  "requirement_model": {
    "pages": [
      {
        "name": "登录页",
        "goal": "用户登录系统"
      }
    ],
    "fields": [],
    "actions": [],
    "rules": [],
    "states": [],
    "exceptions": [],
    "test_points": []
  },
  "issues": [],
  "pending_confirmations": [],
  "generated_artifacts": {}
}
